{
  "$schema": "https://csif.sh/schema/v1/csif.schema.json",
  "title": "npm Essentials",
  "version": "10.x",
  "publicationDate": "2026-01-16",
  "description": "Essential npm commands for Node.js package management.",
  "metadata": {
    "homepage": "https://docs.npmjs.com/",
    "category": "cli"
  },
  "sections": [
    {
      "title": "Project Setup",
      "items": [
        {
          "title": "Initialize project",
          "example": "npm init -y",
          "description": "Create package.json with defaults."
        },
        {
          "title": "Install dependencies",
          "example": "npm install",
          "description": "Install all dependencies from package.json."
        },
        {
          "title": "Clean install",
          "example": "npm ci",
          "description": "Install exact versions from package-lock.json."
        }
      ]
    },
    {
      "title": "Dependencies",
      "items": [
        {
          "title": "Add package",
          "example": "npm install lodash",
          "description": "Install and save as dependency."
        },
        {
          "title": "Add dev dependency",
          "example": "npm install -D typescript",
          "description": "Install as devDependency."
        },
        {
          "title": "Add global",
          "example": "npm install -g npm-check-updates",
          "description": "Install package globally."
        },
        {
          "title": "Remove package",
          "example": "npm uninstall lodash",
          "description": "Remove package and update package.json."
        },
        {
          "title": "List installed",
          "example": "npm ls --depth=0",
          "description": "Show top-level installed packages."
        }
      ]
    },
    {
      "title": "Scripts",
      "items": [
        {
          "title": "Run script",
          "example": "npm run build",
          "description": "Execute a script defined in package.json."
        },
        {
          "title": "Run test",
          "example": "npm test",
          "description": "Run the test script (shorthand)."
        },
        {
          "title": "Run start",
          "example": "npm start",
          "description": "Run the start script (shorthand)."
        },
        {
          "title": "List scripts",
          "example": "npm run",
          "description": "Show all available scripts."
        }
      ]
    },
    {
      "title": "Updates",
      "items": [
        {
          "title": "Check outdated",
          "example": "npm outdated",
          "description": "Show packages with newer versions available."
        },
        {
          "title": "Update packages",
          "example": "npm update",
          "description": "Update packages within semver range."
        },
        {
          "title": "Update npm",
          "example": "npm install -g npm@latest",
          "description": "Update npm itself to latest version."
        }
      ]
    },
    {
      "title": "Info & Debug",
      "items": [
        {
          "title": "View package info",
          "example": "npm info react",
          "description": "Show registry information for a package."
        },
        {
          "title": "Check for vulnerabilities",
          "example": "npm audit",
          "description": "Scan dependencies for security issues."
        },
        {
          "title": "Fix vulnerabilities",
          "example": "npm audit fix",
          "description": "Automatically fix security issues when possible."
        },
        {
          "title": "Why installed",
          "example": "npm explain lodash",
          "description": "Show why a package is installed."
        }
      ]
    },
    {
      "title": "Publishing",
      "items": [
        {
          "title": "Login",
          "example": "npm login",
          "description": "Authenticate with npm registry."
        },
        {
          "title": "Publish",
          "example": "npm publish",
          "description": "Publish package to registry."
        },
        {
          "title": "Bump version",
          "example": "npm version patch",
          "description": "Increment version (patch/minor/major)."
        }
      ]
    }
  ]
}
